{
  "$schema": "https://json-schema.org/draft/2020-12/schema",
  "$id": "https://domes-for-dots.example/schemas/character-spec.schema.json",
  "title": "Domes character-spec v1",
  "type": "object",
  "properties": {
    "schema_version": {
      "const": 1
    },
    "character_id": {
      "type": "string",
      "pattern": "^[a-z][a-z0-9_]{0,63}$"
    },
    "display_name": {
      "type": "string",
      "minLength": 1,
      "maxLength": 2000
    },
    "backend": {
      "const": "procedural_rigid_skin_v1"
    },
    "appearance": {
      "type": "object",
      "properties": {
        "body": {
          "const": "segmented_robot"
        },
        "height_m": {
          "type": "number",
          "minimum": 1.2,
          "maximum": 1.6
        },
        "head_scale": {
          "type": "number",
          "minimum": 0.85,
          "maximum": 1.1
        },
        "colors": {
          "type": "object",
          "properties": {
            "primary": {
              "type": "string",
              "pattern": "^#[0-9a-fA-F]{6}$"
            },
            "secondary": {
              "type": "string",
              "pattern": "^#[0-9a-fA-F]{6}$"
            },
            "accent": {
              "type": "string",
              "pattern": "^#[0-9a-fA-F]{6}$"
            },
            "visor": {
              "type": "string",
              "pattern": "^#[0-9a-fA-F]{6}$"
            }
          },
          "required": [
            "primary",
            "secondary",
            "accent",
            "visor"
          ],
          "additionalProperties": false
        },
        "clothing": {
          "enum": [
            "none",
            "vest"
          ]
        },
        "accessories": {
          "type": "array",
          "items": {
            "enum": [
              "antenna",
              "chest_badge",
              "backpack"
            ]
          },
          "maxItems": 3,
          "uniqueItems": true
        }
      },
      "required": [
        "body",
        "height_m",
        "head_scale",
        "colors",
        "clothing",
        "accessories"
      ],
      "additionalProperties": false
    },
    "references": {
      "type": "array",
      "items": {
        "type": "object",
        "properties": {
          "id": {
            "type": "string",
            "pattern": "^[a-z][a-z0-9_]{0,63}$"
          },
          "sha256": {
            "type": "string",
            "pattern": "^[0-9a-f]{64}$"
          },
          "media_type": {
            "enum": [
              "image/png",
              "image/jpeg"
            ]
          },
          "bytes": {
            "type": "integer",
            "minimum": 1,
            "maximum": 10485760
          },
          "description": {
            "type": "string",
            "minLength": 1,
            "maxLength": 2000
          },
          "source": {
            "type": "string",
            "minLength": 1,
            "maxLength": 2000
          },
          "license": {
            "type": "string",
            "minLength": 1,
            "maxLength": 2000
          }
        },
        "required": [
          "id",
          "sha256",
          "media_type",
          "bytes",
          "description",
          "source",
          "license"
        ],
        "additionalProperties": false
      },
      "minItems": 1,
      "maxItems": 5
    },
    "creative_intent": {
      "type": "object",
      "properties": {
        "self_image": {
          "type": "string",
          "minLength": 1,
          "maxLength": 2000
        },
        "personality_cues": {
          "type": "array",
          "items": {
            "type": "string",
            "minLength": 1,
            "maxLength": 2000
          },
          "maxItems": 32,
          "uniqueItems": true
        },
        "identifying_features": {
          "type": "array",
          "items": {
            "type": "string",
            "minLength": 1,
            "maxLength": 2000
          },
          "maxItems": 32,
          "uniqueItems": true
        },
        "activities": {
          "type": "array",
          "items": {
            "enum": [
              "idle",
              "walk",
              "interact",
              "sit",
              "work",
              "read",
              "build",
              "inspect",
              "garden",
              "sleep",
              "talk",
              "phone"
            ]
          },
          "maxItems": 12,
          "uniqueItems": true
        }
      },
      "required": [
        "self_image",
        "personality_cues",
        "identifying_features",
        "activities"
      ],
      "additionalProperties": false
    },
    "decisions": {
      "type": "object",
      "properties": {
        "human_approved": {
          "const": true
        },
        "veto_accessories": {
          "type": "array",
          "items": {
            "enum": [
              "antenna",
              "chest_badge",
              "backpack"
            ]
          },
          "maxItems": 3,
          "uniqueItems": true
        },
        "human_notes": {
          "type": "string",
          "maxLength": 2000
        },
        "implementation_scope": {
          "type": "string",
          "minLength": 1,
          "maxLength": 2000
        },
        "unimplemented_intent": {
          "type": "array",
          "items": {
            "type": "string",
            "minLength": 1,
            "maxLength": 2000
          },
          "maxItems": 32,
          "uniqueItems": true
        }
      },
      "required": [
        "human_approved",
        "veto_accessories",
        "human_notes",
        "implementation_scope",
        "unimplemented_intent"
      ],
      "additionalProperties": false
    },
    "input_sha256": {
      "type": "string",
      "pattern": "^[0-9a-f]{64}$"
    }
  },
  "required": [
    "schema_version",
    "character_id",
    "display_name",
    "backend",
    "appearance",
    "references",
    "creative_intent",
    "decisions",
    "input_sha256"
  ],
  "additionalProperties": false
}
