{
  "schema_version": 1,
  "character_id": "fern_synthetic",
  "display_name": "Fern",
  "backend": "procedural_rigid_skin_v1",
  "appearance": {
    "accessories": [
      "chest_badge"
    ],
    "body": "segmented_robot",
    "clothing": "vest",
    "colors": {
      "accent": "#e8a772",
      "primary": "#9eac7b",
      "secondary": "#85644e",
      "visor": "#152735"
    },
    "head_scale": 1.0,
    "height_m": 1.4
  },
  "references": [
    {
      "id": "approved_robot_card",
      "description": "Original flat front-view segmented teal robot concept with amber eyes and chest badge. A design reference, not a 3D reconstruction target.",
      "source": "Original project fixture authored by Domes contributors; not Rocky imagery",
      "license": "MIT",
      "sha256": "848f1996d7adeabf6d5995304f86902da3c1b92ae639baa48f92d16e1c7dd682",
      "media_type": "image/png",
      "bytes": 1010
    }
  ],
  "creative_intent": {
    "self_image": "Independent synthetic Fern character for verdant_courtyard",
    "personality_cues": [
      "Curious and patient; this fixture demonstrates recording creative intent."
    ],
    "identifying_features": [
      "Warm amber square eyes and a small chest badge."
    ],
    "activities": [
      "work",
      "read",
      "build",
      "inspect",
      "garden",
      "sleep",
      "talk",
      "phone"
    ]
  },
  "decisions": {
    "human_approved": true,
    "veto_accessories": [
      "antenna"
    ],
    "human_notes": "Independent synthetic fixture; approved original reusable reference card, no private identity.",
    "implementation_scope": "Original segmented robot from explicit palette, proportions, clothing and accessory choices. Images are approved reference evidence; this backend does not infer geometry from pixels. Gestures have no automatic prop contact or arbitrary-rig retargeting.",
    "unimplemented_intent": [
      "Warm amber square eyes and a small chest badge.",
      "Curious and patient; this fixture demonstrates recording creative intent."
    ]
  },
  "input_sha256": "e4c98ef5bd8ee4a9ac7e0ecb81d16e26f859c79e3dd91d5fff4366e20079c720"
}
